[
  {
    "id": "ko_k1_g01",
    "form": "이다: 이에요/예요",
    "meaning_ja": "〜です",
    "category": "copula",
    "example": "여기는 우리 집이에요.",
    "notes": "名詞述語。받침あり이에요、なし예요。過去였어요/이었어요はg03と組み合わせる。否定はCore 아니다でN이/가 아니에요。"
  },
  {
    "id": "ko_k1_g02",
    "form": "-아요/어요",
    "meaning_ja": "〜ます・〜です（現在）",
    "category": "ending",
    "example": "저는 매일 학교에 가요.",
    "notes": "動詞・形容詞の해요체。하다→해요等の縮約・不規則活用を認める。独立した新文法を追加しない。"
  },
  {
    "id": "ko_k1_g03",
    "form": "-았/었어요",
    "meaning_ja": "〜ました・〜でした",
    "category": "tense",
    "example": "저는 어제 책을 읽었어요.",
    "notes": "했어요等の縮約を認める。経験・過去連体形や大過去-았었-は未許可。"
  },
  {
    "id": "ko_k1_g04",
    "form": "-(으)ㄹ 거예요",
    "meaning_ja": "〜する予定です",
    "category": "tense",
    "example": "저는 내일 학교에 갈 거예요.",
    "notes": "予定中心。推量の多用は避ける。거/것のこの構文内用法だけ許可。自由な名詞化は不可。"
  },
  {
    "id": "ko_k1_g05",
    "form": "-고 있다",
    "meaning_ja": "〜しています",
    "category": "aspect",
    "example": "저는 지금 책을 읽고 있어요.",
    "notes": "進行のみ。着用・結果状態や-아/어 있다は未許可。있다は補助用言として文法内で認可。"
  },
  {
    "id": "ko_k1_g06",
    "form": "-고 싶다",
    "meaning_ja": "〜したいです",
    "category": "modality",
    "example": "저는 지금 물을 마시고 싶어요.",
    "notes": "動詞に接続。本人の希望・相手への質問を中心にする。第三者の-고 싶어하다は未許可。"
  },
  {
    "id": "ko_k1_g07",
    "form": "안",
    "meaning_ja": "〜しません・〜くありません",
    "category": "negation",
    "example": "저는 오늘 학교에 안 가요.",
    "notes": "短形否定。名詞+하다語では공부 안 해요等を認めるが、否定できない語に機械的に付けない。-지 않다は未許可。"
  },
  {
    "id": "ko_k1_g08",
    "form": "못",
    "meaning_ja": "〜できません",
    "category": "negation",
    "example": "저는 오늘 학교에 못 가요.",
    "notes": "動詞の不可能のみ。能力・状況による不可能。形容詞への一律付加は禁止。"
  },
  {
    "id": "ko_k1_g09",
    "form": "-고",
    "meaning_ja": "〜して・〜で（並列・順序）",
    "category": "connector",
    "example": "저는 밥을 먹고 학교에 가요.",
    "notes": "2事態までを優先。長い列挙は避ける。"
  },
  {
    "id": "ko_k1_g10",
    "form": "-지만",
    "meaning_ja": "〜ですが",
    "category": "connector",
    "example": "방은 작지만 아주 좋아요.",
    "notes": "対比・逆接。1文の接続節は通常1つ。"
  },
  {
    "id": "ko_k1_g11",
    "form": "-아/어서",
    "meaning_ja": "〜なので・〜して（順序）",
    "category": "connector",
    "example": "오늘은 비가 와서 집에 있어요.",
    "notes": "理由と密接な順序。理由用法の後ろの命令・勧誘、接続直前の過去-았/었-は避ける。"
  },
  {
    "id": "ko_k1_g12",
    "form": "-(으)니까",
    "meaning_ja": "〜なので",
    "category": "connector",
    "example": "오늘은 비가 오니까 우산을 가져가세요.",
    "notes": "理由。命令・勧誘への接続も許可。発見用法は未許可。"
  },
  {
    "id": "ko_k1_g13",
    "form": "-(으)면",
    "meaning_ja": "〜なら・〜したら",
    "category": "connector",
    "example": "시간이 있으면 같이 책을 읽어요.",
    "notes": "具体的な条件のみ。反実仮想・複雑な仮定は避ける。"
  },
  {
    "id": "ko_k1_g14",
    "form": "-(으)세요",
    "meaning_ja": "〜してください",
    "category": "request",
    "example": "여기에서 우리 친구를 기다리세요.",
    "notes": "依頼・指示のみ。一般的な尊敬-(으)시-や드리다の派生を許可しない。命令対象は動作動詞を中心にする。"
  },
  {
    "id": "ko_k1_g15",
    "form": "-(으)ㄹ까요",
    "meaning_ja": "〜しましょうか・〜でしょうか",
    "category": "proposal",
    "example": "우리 같이 공원에 갈까요?",
    "notes": "勧誘・意向確認を中心にする。複雑な推量質問は避ける。"
  },
  {
    "id": "ko_k1_g16",
    "form": "-(으)ㄹ 수 있다/없다",
    "meaning_ja": "〜できます・できません",
    "category": "modality",
    "example": "저는 한국어를 읽을 수 있어요.",
    "notes": "수はこの構文専用の依存名詞。있다/없다の補助用法のみ許可。自由な수の語義は不可。"
  },
  {
    "id": "ko_k1_g17",
    "form": "-아/어야 하다",
    "meaning_ja": "〜しなければなりません",
    "category": "modality",
    "example": "저는 오늘 숙제를 해야 해요.",
    "notes": "義務の基本形。-아/어야 되다や-아/어야等の別構文は未許可。"
  },
  {
    "id": "ko_k1_g18",
    "form": "-아/어 보다",
    "meaning_ja": "試しに〜してみます",
    "category": "auxiliary",
    "example": "이 책을 읽어 봐요.",
    "notes": "試行のみ。보다は補助用法を文法内で許可。経験-아/어 봤다はg03と組み合わせ可。一般的な補助動詞構文への拡張は不可。"
  },
  {
    "id": "ko_k1_g19",
    "form": "은/는",
    "meaning_ja": "主題・対比",
    "category": "particle",
    "example": "저는 매일 학교에 가요.",
    "notes": "話題を示す。隠れた対比の説明負荷は避ける。"
  },
  {
    "id": "ko_k1_g20",
    "form": "이/가",
    "meaning_ja": "主語",
    "category": "particle",
    "example": "친구가 지금 집에 있어요.",
    "notes": "아니다の補語にも使用。누구+가→누가、나+가→내가、저+가→제가、너+가→네가を同一語に正規化。"
  },
  {
    "id": "ko_k1_g21",
    "form": "을/를",
    "meaning_ja": "目的語",
    "category": "particle",
    "example": "저는 매일 책을 읽어요.",
    "notes": "目的語の基本用法のみ。数え方では助詞を語彙に含めない。"
  },
  {
    "id": "ko_k1_g22",
    "form": "에",
    "meaning_ja": "場所・行先・時点",
    "category": "particle",
    "example": "저는 아침에 학교에 가요.",
    "notes": "存在の場所、移動の行先、時点。数量당等の拡張は未許可。"
  },
  {
    "id": "ko_k1_g23",
    "form": "에서",
    "meaning_ja": "動作の場所",
    "category": "particle",
    "example": "저는 집에서 책을 읽어요.",
    "notes": "動作の場所のみ。起点は追加候補として保留。"
  },
  {
    "id": "ko_k1_g24",
    "form": "도",
    "meaning_ja": "〜も",
    "category": "particle",
    "example": "저도 오늘 학교에 가요.",
    "notes": "単純な追加。疑問語+도等は아무 N도の許可範囲以外へ拡張しない。"
  },
  {
    "id": "ko_k1_g25",
    "form": "하고",
    "meaning_ja": "〜と（名詞並列・共同）",
    "category": "particle",
    "example": "저는 친구하고 밥을 먹어요.",
    "notes": "接続・共同格。用言하다+고と区別する。와/과・(이)랑は未許可。"
  },
  {
    "id": "ko_k1_g26",
    "form": "-(으)ㄴ",
    "meaning_ja": "〜い・〜な（形容詞連体）",
    "category": "adnominal",
    "example": "저는 작은 가방을 샀어요.",
    "notes": "形容詞のみ。있다/없다の있는/없는は個別異形。動詞過去連体形は未許可。連体節の深い埋め込みは避ける。"
  },
  {
    "id": "ko_k1_g27",
    "form": "-는",
    "meaning_ja": "〜する（動詞現在連体）",
    "category": "adnominal",
    "example": "저는 친구가 읽는 책을 봐요.",
    "notes": "現在連体形のみ。動詞の-(으)ㄴ/-(으)ㄹはこの項目では未許可。"
  },
  {
    "id": "ko_k1_g28",
    "form": "에게/한테",
    "meaning_ja": "人に（受け手・相手）",
    "category": "particle",
    "example": "저는 친구한테 책을 줘요.",
    "notes": "해요체では한테優先。에게서/한테서は未許可。"
  },
  {
    "id": "ko_k1_g29",
    "form": "의",
    "meaning_ja": "〜の（所有）",
    "category": "particle",
    "example": "이것은 친구의 책이에요.",
    "notes": "所有・所属のみ。나의→내、저의→제を同一語に正規化。이/그/저の指示連体詞と混同しない。"
  }
]
